{
  "status": "FAIL",
  "rationale": "The interpreter output contains unresolved ambiguities that block a PASS determination. Each listed ambiguity must be clarified before the implementation can be considered complete.",
  "findings": [
    {
      "id": "F1",
      "severity": "MEDIUM",
      "kind": "OPEN_AMBIGUITY",
      "description": "The interpreter reports that the exact Roof Type option list is unspecified.",
      "action": "Obtain clarification from the ticket owner on the complete Roof Type option list.",
      "sourceRefs": [
        {
          "artifact": "interpreter",
          "pointer": "/ambiguities/0",
          "quote": "The exact Roof Type option list is unspecified."
        }
      ],
      "ambiguityRefs": [
        "/ambiguities/0"
      ]
    },
    {
      "id": "F2",
      "severity": "MEDIUM",
      "kind": "OPEN_AMBIGUITY",
      "description": "The interpreter reports that the EC Model catalog entries are unspecified.",
      "action": "Obtain clarification from the ticket owner on the EC Model catalog entries that should be available.",
      "sourceRefs": [
        {
          "artifact": "interpreter",
          "pointer": "/ambiguities/1",
          "quote": "The EC Model catalog entries are unspecified."
        }
      ],
      "ambiguityRefs": [
        "/ambiguities/1"
      ]
    },
    {
      "id": "F3",
      "severity": "MEDIUM",
      "kind": "OPEN_AMBIGUITY",
      "description": "The interpreter reports that numeric validation ranges are unspecified.",
      "action": "Obtain clarification from the ticket owner on the acceptable numeric ranges for all input fields.",
      "sourceRefs": [
        {
          "artifact": "interpreter",
          "pointer": "/ambiguities/2",
          "quote": "Numeric validation ranges are unspecified."
        }
      ],
      "ambiguityRefs": [
        "/ambiguities/2"
      ]
    },
    {
      "id": "F4",
      "severity": "MEDIUM",
      "kind": "OPEN_AMBIGUITY",
      "description": "The interpreter reports that temperature conversion and unit selection behavior are unspecified.",
      "action": "Obtain clarification from the ticket owner on how temperature units are selected and whether automatic conversion is required.",
      "sourceRefs": [
        {
          "artifact": "interpreter",
          "pointer": "/ambiguities/3",
          "quote": "Temperature conversion and unit selection behavior are unspecified."
        }
      ],
      "ambiguityRefs": [
        "/ambiguities/3"
      ]
    },
    {
      "id": "F5",
      "severity": "MEDIUM",
      "kind": "OPEN_AMBIGUITY",
      "description": "The interpreter reports that the detailed per-circuit configuration fields are unspecified.",
      "action": "Obtain clarification from the ticket owner on the specific per-circuit cooling configuration fields required.",
      "sourceRefs": [
        {
          "artifact": "interpreter",
          "pointer": "/ambiguities/4",
          "quote": "The detailed per-circuit configuration fields are unspecified."
        }
      ],
      "ambiguityRefs": [
        "/ambiguities/4"
      ]
    }
  ],
  "resolutions": []
}