{
  "status": "FAIL",
  "rationale": "The interpreter accurately reflects all explicit requirements from the ticket, but it leaves two open ambiguities regarding the definition of a \"height edit\" and whether circuit addition/removal should trigger recalculation. These unresolved questions block a PASS result.",
  "findings": [
    {
      "id": "F1",
      "severity": "MEDIUM",
      "kind": "OPEN_AMBIGUITY",
      "description": "Unclear which actions are considered a \"height edit\" that should trigger recalculation.",
      "action": "Obtain clarification from the ticket owner on the specific actions that constitute a height edit (e.g., editing a circuit height, adding or removing circuits).",
      "sourceRefs": [
        {
          "artifact": "interpreter",
          "pointer": "/ambiguities/0",
          "quote": "What specific actions are considered a \"height edit\" that should trigger recalculation (e.g., editing a circuit height, adding or removing circuits)?"
        }
      ],
      "ambiguityRefs": [
        "/ambiguities/0"
      ]
    },
    {
      "id": "F2",
      "severity": "MEDIUM",
      "kind": "OPEN_AMBIGUITY",
      "description": "Unclear whether recalculation should also occur when circuits are added to or removed from the list, or only when an existing circuit's height value changes.",
      "action": "Obtain clarification from the ticket owner on whether recalculation is required on circuit addition/removal or only on height value changes.",
      "sourceRefs": [
        {
          "artifact": "interpreter",
          "pointer": "/ambiguities/1",
          "quote": "Should recalculation also occur when circuits are added to or removed from the list, or only when an existing circuit's height value changes?"
        }
      ],
      "ambiguityRefs": [
        "/ambiguities/1"
      ]
    }
  ],
  "resolutions": []
}