{
  "status": "PASS",
  "rationale": "The interpreter output now includes the required behavior that when a Circuit Height is edited, the DX Coil Information is updated with the recomputed total height. This satisfies the ticket's core requirement. No unsupported assumptions, HVAC errors, missing validations, or ambiguities remain.",
  "findings": [],
  "resolutions": [
    {
      "findingId": "DX-F1",
      "rationale": "The interpreter output now captures the edit‑triggered recalculation and update of DX Coil Information, addressing the previously missing requirement.",
      "sourceRefs": [
        {
          "artifact": "interpreter",
          "pointer": "/developerConsiderations/0",
          "quote": "Update DX Coil Information when a Circuit Height is edited."
        }
      ]
    }
  ]
}