{
  "status": "PASS",
  "rationale": "The interpreter output fully captures all propositions from the ticket: the DX Coil Height definition, immediate recalculation on edit, handling of an empty circuit list, and the statement that inputs are already validated. No unsupported assumptions, missing requirements, HVAC errors, validation gaps, or ambiguities are present.",
  "findings": [],
  "resolutions": []
}