{
  "status": "FAIL",
  "rationale": "The interpreter output leaves several ambiguities unresolved, requiring clarification before implementation can proceed.",
  "findings": [
    {
      "id": "A0",
      "severity": "MEDIUM",
      "kind": "OPEN_AMBIGUITY",
      "description": "Height units are unspecified.",
      "action": "Obtain clarification from the ticket owner on the height units to be used.",
      "sourceRefs": [
        {
          "artifact": "interpreter",
          "pointer": "/ambiguities/0",
          "quote": "Height units are unspecified."
        }
      ],
      "ambiguityRefs": [
        "/ambiguities/0"
      ]
    },
    {
      "id": "A1",
      "severity": "MEDIUM",
      "kind": "OPEN_AMBIGUITY",
      "description": "Valid height ranges and precision are unspecified.",
      "action": "Obtain clarification from the ticket owner on acceptable height ranges and required precision.",
      "sourceRefs": [
        {
          "artifact": "interpreter",
          "pointer": "/ambiguities/1",
          "quote": "Valid height ranges and precision are unspecified."
        }
      ],
      "ambiguityRefs": [
        "/ambiguities/1"
      ]
    },
    {
      "id": "A2",
      "severity": "MEDIUM",
      "kind": "OPEN_AMBIGUITY",
      "description": "The source and format of starting circuit values are unspecified.",
      "action": "Obtain clarification from the ticket owner on how the initial circuit heights are sourced and formatted.",
      "sourceRefs": [
        {
          "artifact": "interpreter",
          "pointer": "/ambiguities/2",
          "quote": "The source and format of starting circuit values are unspecified."
        }
      ],
      "ambiguityRefs": [
        "/ambiguities/2"
      ]
    },
    {
      "id": "A3",
      "severity": "MEDIUM",
      "kind": "OPEN_AMBIGUITY",
      "description": "Behavior when circuits are added or removed is unspecified.",
      "action": "Obtain clarification from the ticket owner on how the system should handle addition or removal of circuits.",
      "sourceRefs": [
        {
          "artifact": "interpreter",
          "pointer": "/ambiguities/3",
          "quote": "Behavior when circuits are added or removed is unspecified."
        }
      ],
      "ambiguityRefs": [
        "/ambiguities/3"
      ]
    }
  ],
  "resolutions": [
    {
      "findingId": "DX-F1",
      "rationale": "The interpreter now includes the edit-triggered recalculation and update of DX Coil Information, satisfying the previously missing requirement.",
      "sourceRefs": [
        {
          "artifact": "ticket",
          "pointer": "",
          "quote": "should the user alter the Circuit Height"
        },
        {
          "artifact": "interpreter",
          "pointer": "/businessRules/2",
          "quote": "Editing any Circuit Height recalculates the sum and updates DX Coil Information."
        }
      ]
    }
  ]
}