{
  "status": "FAIL",
  "rationale": "The interpreter output incorrectly specifies the label for displaying the calculated height as \"DX height\" instead of the exact required label \"DX Coil Height\" as stated in the ticket. This violates the core business requirement and would lead to incorrect UI labeling.",
  "findings": [
    {
      "id": "F1",
      "severity": "HIGH",
      "kind": "MISSING_REQUIREMENT",
      "description": "The interpreter's business rule uses the label \"DX height\" instead of the required exact label \"DX Coil Height\".",
      "action": "Update the businessRules to use the exact label \"DX Coil Height\" when displaying the calculated height.",
      "sourceRefs": [
        {
          "artifact": "ticket",
          "pointer": "",
          "quote": "Display the calculated height using the exact label \"DX Coil Height\"."
        },
        {
          "artifact": "interpreter",
          "pointer": "/businessRules/0",
          "quote": "Display the calculated height using the label \"DX height\"."
        }
      ],
      "ambiguityRefs": []
    }
  ],
  "resolutions": []
}