{
  "status": "FAIL",
  "rationale": "The interpreter introduced an unsupported assumption that the DX Coil Height field is read‑only, which is not specified in the ticket. Additionally, the interpreter listed several ambiguities that remain unresolved, each requiring clarification before implementation can proceed.",
  "findings": [
    {
      "id": "F1",
      "severity": "HIGH",
      "kind": "UNSUPPORTED_ASSUMPTION",
      "description": "The interpreter assumes the DX Coil Height field is read‑only, which is not stated in the ticket.",
      "action": "Remove the read‑only assumption or obtain clarification from the ticket owner about whether the DX Coil Height field should be editable.",
      "sourceRefs": [
        {
          "artifact": "ticket",
          "pointer": "",
          "quote": "- and should the user alter the Circuit Height - the form should react to this edit - resum all heights and update the Height field in DX Coil Information"
        },
        {
          "artifact": "interpreter",
          "pointer": "/developerConsiderations/0",
          "quote": "Treat the DX Coil Height field as a system‑generated value that updates automatically (read‑only from the user's perspective)."
        }
      ],
      "ambiguityRefs": []
    },
    {
      "id": "F2",
      "severity": "MEDIUM",
      "kind": "OPEN_AMBIGUITY",
      "description": "The ticket does not specify the unit of measurement for Circuit Height and DX Coil Height.",
      "action": "Obtain clarification from the ticket owner on the required unit of measurement (e.g., inches, centimeters).",
      "sourceRefs": [
        {
          "artifact": "interpreter",
          "pointer": "/ambiguities/0",
          "quote": "The unit of measurement for Circuit Height and DX Coil Height is not specified."
        }
      ],
      "ambiguityRefs": [
        "/ambiguities/0"
      ]
    },
    {
      "id": "F3",
      "severity": "MEDIUM",
      "kind": "OPEN_AMBIGUITY",
      "description": "Rounding or precision requirements for the summed DX Coil Height are not defined.",
      "action": "Clarify from the ticket owner whether the summed height should be rounded, and if so, to what precision or increment.",
      "sourceRefs": [
        {
          "artifact": "interpreter",
          "pointer": "/ambiguities/1",
          "quote": "Rounding or precision requirements for the summed DX Coil Height are not defined."
        }
      ],
      "ambiguityRefs": [
        "/ambiguities/1"
      ]
    },
    {
      "id": "F4",
      "severity": "MEDIUM",
      "kind": "OPEN_AMBIGUITY",
      "description": "Validation rules for acceptable Circuit Height values (e.g., non‑negative, maximum) are not provided.",
      "action": "Request clarification on validation constraints for Circuit Height values, such as allowed range or non‑negative requirement.",
      "sourceRefs": [
        {
          "artifact": "interpreter",
          "pointer": "/ambiguities/2",
          "quote": "Validation rules for acceptable Circuit Height values (e.g., non‑negative, maximum) are not provided."
        }
      ],
      "ambiguityRefs": [
        "/ambiguities/2"
      ]
    },
    {
      "id": "F5",
      "severity": "MEDIUM",
      "kind": "OPEN_AMBIGUITY",
      "description": "Behavior when Cooling Circuits are added or removed after the initial calculation is not described.",
      "action": "Clarify how the system should handle dynamic addition or removal of Cooling Circuits after the initial sum has been computed.",
      "sourceRefs": [
        {
          "artifact": "interpreter",
          "pointer": "/ambiguities/3",
          "quote": "Behavior when Cooling Circuits are added or removed after the initial calculation is not described."
        }
      ],
      "ambiguityRefs": [
        "/ambiguities/3"
      ]
    },
    {
      "id": "F6",
      "severity": "MEDIUM",
      "kind": "OPEN_AMBIGUITY",
      "description": "Whether the DX Coil Height field should be editable by the user or strictly read‑only is unclear.",
      "action": "Obtain clarification on whether users are allowed to edit the DX Coil Height field directly or if it must remain read‑only.",
      "sourceRefs": [
        {
          "artifact": "interpreter",
          "pointer": "/ambiguities/4",
          "quote": "Whether the DX Coil Height field should be editable by the user or strictly read‑only is unclear."
        }
      ],
      "ambiguityRefs": [
        "/ambiguities/4"
      ]
    }
  ],
  "resolutions": []
}