{
  "status": "FAIL",
  "rationale": "The interpreter introduced an unsupported business rule and left three unresolved ambiguities, each of which must be clarified before the implementation can be considered complete.",
  "findings": [
    {
      "id": "F1",
      "severity": "HIGH",
      "kind": "UNSUPPORTED_ASSUMPTION",
      "description": "The interpreter adds a rule to always exclude entries with isActive=false, which is not specified in the ticket.",
      "action": "Remove the unsupported exclusion rule or obtain explicit ticket clarification that inactive entries must be excluded.",
      "sourceRefs": [
        {
          "artifact": "ticket",
          "pointer": "",
          "quote": "\"isActive\": true"
        },
        {
          "artifact": "interpreter",
          "pointer": "/businessRules/2",
          "quote": "Always exclude entries with isActive=false."
        }
      ],
      "ambiguityRefs": []
    },
    {
      "id": "F2",
      "severity": "MEDIUM",
      "kind": "OPEN_AMBIGUITY",
      "description": "The Condenser Type mapping is unclear because the example parent data contains refrigerants.",
      "action": "Obtain clarification from the ticket owner on how Condenser Type should be mapped to the parent data.",
      "sourceRefs": [
        {
          "artifact": "interpreter",
          "pointer": "/ambiguities/0",
          "quote": "The Condenser Type mapping is unclear because the example parent data contains refrigerants."
        }
      ],
      "ambiguityRefs": [
        "/ambiguities/0"
      ]
    },
    {
      "id": "F3",
      "severity": "MEDIUM",
      "kind": "OPEN_AMBIGUITY",
      "description": "Empty filter-result behavior is unspecified.",
      "action": "Clarify with the ticket owner what should happen when a filter yields no results (e.g., show empty list, display message, disable dropdown).",
      "sourceRefs": [
        {
          "artifact": "interpreter",
          "pointer": "/ambiguities/1",
          "quote": "Empty filter-result behavior is unspecified."
        }
      ],
      "ambiguityRefs": [
        "/ambiguities/1"
      ]
    },
    {
      "id": "F4",
      "severity": "MEDIUM",
      "kind": "OPEN_AMBIGUITY",
      "description": "Case sensitivity and downstream selection reset behavior are unspecified.",
      "action": "Obtain clarification on case‑sensitivity handling and whether selecting a new value should reset dependent dropdowns.",
      "sourceRefs": [
        {
          "artifact": "interpreter",
          "pointer": "/ambiguities/2",
          "quote": "Case sensitivity and downstream selection reset behavior are unspecified."
        }
      ],
      "ambiguityRefs": [
        "/ambiguities/2"
      ]
    }
  ],
  "resolutions": []
}